[
  {"event_id":"evt-0001","event_time":"2026-04-01T09:00:00Z","event_type":"product_view","customer_id":"C001","session_id":"S001","product_id":"P001","campaign_id":"CMP001","channel":"email","device_type":"mobile","order_id":null,"quantity":null,"event_value":39.99},
  {"event_id":"evt-0002","event_time":"2026-04-01T09:00:10Z","event_type":"add_to_cart","customer_id":"C001","session_id":"S001","product_id":"P001","campaign_id":"CMP001","channel":"email","device_type":"mobile","order_id":null,"quantity":1,"event_value":39.99},
  {"event_id":"evt-0003","event_time":"2026-04-01T09:00:25Z","event_type":"checkout_started","customer_id":"C001","session_id":"S001","product_id":"P001","campaign_id":"CMP001","channel":"email","device_type":"mobile","order_id":null,"quantity":1,"event_value":39.99},
  {"event_id":"evt-0004","event_time":"2026-04-01T09:00:45Z","event_type":"order_submitted","customer_id":"C001","session_id":"S001","product_id":"P001","campaign_id":"CMP001","channel":"email","device_type":"mobile","order_id":"O1001","quantity":1,"event_value":39.99},
  {"event_id":"evt-0005","event_time":"2026-04-01T09:01:00Z","event_type":"email_clicked","customer_id":"C002","session_id":"S002","product_id":"P003","campaign_id":"CMP002","channel":"email","device_type":"desktop","order_id":null,"quantity":null,"event_value":0},
  {"event_id":"evt-0006","event_time":"2026-04-01T09:01:12Z","event_type":"product_view","customer_id":"C002","session_id":"S002","product_id":"P003","campaign_id":"CMP002","channel":"email","device_type":"desktop","order_id":null,"quantity":null,"event_value":59.95},
  {"event_id":"evt-0007","event_time":"2026-04-01T09:01:28Z","event_type":"add_to_cart","customer_id":"C002","session_id":"S002","product_id":"P003","campaign_id":"CMP002","channel":"email","device_type":"desktop","order_id":null,"quantity":1,"event_value":59.95},
  {"event_id":"evt-0008","event_time":"2026-04-01T09:01:41Z","event_type":"remove_from_cart","customer_id":"C002","session_id":"S002","product_id":"P003","campaign_id":"CMP002","channel":"email","device_type":"desktop","order_id":null,"quantity":1,"event_value":59.95},
  {"event_id":"evt-0009","event_time":"2026-04-01T09:02:02Z","event_type":"product_view","customer_id":"C003","session_id":"S003","product_id":"P004","campaign_id":"CMP003","channel":"organic","device_type":"mobile","order_id":null,"quantity":null,"event_value":24.50},
  {"event_id":"evt-0010","event_time":"2026-04-01T09:02:15Z","event_type":"add_to_cart","customer_id":"C003","session_id":"S003","product_id":"P004","campaign_id":"CMP003","channel":"organic","device_type":"mobile","order_id":null,"quantity":2,"event_value":49.00},
  {"event_id":"evt-0011","event_time":"2026-04-01T09:02:30Z","event_type":"checkout_started","customer_id":"C003","session_id":"S003","product_id":"P004","campaign_id":"CMP003","channel":"organic","device_type":"mobile","order_id":null,"quantity":2,"event_value":49.00},
  {"event_id":"evt-0012","event_time":"2026-04-01T09:02:44Z","event_type":"order_submitted","customer_id":"C003","session_id":"S003","product_id":"P004","campaign_id":"CMP003","channel":"organic","device_type":"mobile","order_id":"O1002","quantity":2,"event_value":49.00},
  {"event_id":"evt-0013","event_time":"2026-04-01T09:03:00Z","event_type":"product_view","customer_id":"C004","session_id":"S004","product_id":"P005","campaign_id":"CMP001","channel":"paid_search","device_type":"desktop","order_id":null,"quantity":null,"event_value":89.00},
  {"event_id":"evt-0014","event_time":"2026-04-01T09:03:14Z","event_type":"product_view","customer_id":"C005","session_id":"S005","product_id":"P002","campaign_id":null,"channel":"direct","device_type":"mobile","order_id":null,"quantity":null,"event_value":19.99},
  {"event_id":"evt-0015","event_time":"2026-04-01T09:03:26Z","event_type":"add_to_cart","customer_id":"C005","session_id":"S005","product_id":"P002","campaign_id":null,"channel":"direct","device_type":"mobile","order_id":null,"quantity":3,"event_value":59.97},
  {"event_id":"evt-0016","event_time":"2026-04-01T09:03:48Z","event_type":"checkout_started","customer_id":"C005","session_id":"S005","product_id":"P002","campaign_id":null,"channel":"direct","device_type":"mobile","order_id":null,"quantity":3,"event_value":59.97},
  {"event_id":"evt-0017","event_time":"2026-04-01T09:04:09Z","event_type":"order_submitted","customer_id":"C005","session_id":"S005","product_id":"P002","campaign_id":null,"channel":"direct","device_type":"mobile","order_id":"O1003","quantity":3,"event_value":59.97},
  {"event_id":"evt-0018","event_time":"2026-04-01T09:04:31Z","event_type":"email_clicked","customer_id":"C006","session_id":"S006","product_id":"P006","campaign_id":"CMP002","channel":"email","device_type":"desktop","order_id":null,"quantity":null,"event_value":0},
  {"event_id":"evt-0019","event_time":"2026-04-01T09:04:45Z","event_type":"product_view","customer_id":"C006","session_id":"S006","product_id":"P006","campaign_id":"CMP002","channel":"email","device_type":"desktop","order_id":null,"quantity":null,"event_value":14.75},
  {"event_id":"evt-0020","event_time":"2026-04-01T09:05:05Z","event_type":"product_view","customer_id":"C007","session_id":"S007","product_id":"P007","campaign_id":"CMP004","channel":"affiliate","device_type":"tablet","order_id":null,"quantity":null,"event_value":129.00},
  {"event_id":"evt-0021","event_time":"2026-04-01T09:05:19Z","event_type":"add_to_cart","customer_id":"C007","session_id":"S007","product_id":"P007","campaign_id":"CMP004","channel":"affiliate","device_type":"tablet","order_id":null,"quantity":1,"event_value":129.00},
  {"event_id":"evt-0022","event_time":"2026-04-01T09:05:37Z","event_type":"checkout_started","customer_id":"C007","session_id":"S007","product_id":"P007","campaign_id":"CMP004","channel":"affiliate","device_type":"tablet","order_id":null,"quantity":1,"event_value":129.00},
  {"event_id":"evt-0023","event_time":"2026-04-01T09:05:55Z","event_type":"order_submitted","customer_id":"C007","session_id":"S007","product_id":"P007","campaign_id":"CMP004","channel":"affiliate","device_type":"tablet","order_id":"O1004","quantity":1,"event_value":129.00},
  {"event_id":"evt-0024","event_time":"2026-04-01T09:06:16Z","event_type":"product_view","customer_id":"C008","session_id":"S008","product_id":"P008","campaign_id":null,"channel":"organic","device_type":"mobile","order_id":null,"quantity":null,"event_value":9.99},
  {"event_id":"evt-0025","event_time":"2026-04-01T09:06:30Z","event_type":"add_to_cart","customer_id":"C008","session_id":"S008","product_id":"P008","campaign_id":null,"channel":"organic","device_type":"mobile","order_id":null,"quantity":2,"event_value":19.98},
  {"event_id":"evt-0026","event_time":"2026-04-01T09:06:43Z","event_type":"remove_from_cart","customer_id":"C008","session_id":"S008","product_id":"P008","campaign_id":null,"channel":"organic","device_type":"mobile","order_id":null,"quantity":1,"event_value":9.99},
  {"event_id":"evt-0027","event_time":"2026-04-01T09:07:05Z","event_type":"product_view","customer_id":"C009","session_id":"S009","product_id":"P009","campaign_id":"CMP003","channel":"paid_social","device_type":"desktop","order_id":null,"quantity":null,"event_value":44.00},
  {"event_id":"evt-0028","event_time":"2026-04-01T09:07:17Z","event_type":"email_clicked","customer_id":"C010","session_id":"S010","product_id":"P010","campaign_id":"CMP005","channel":"email","device_type":"mobile","order_id":null,"quantity":null,"event_value":0},
  {"event_id":"evt-0029","event_time":"2026-04-01T09:07:29Z","event_type":"product_view","customer_id":"C010","session_id":"S010","product_id":"P010","campaign_id":"CMP005","channel":"email","device_type":"mobile","order_id":null,"quantity":null,"event_value":74.50},
  {"event_id":"evt-0030","event_time":"2026-04-01T09:07:52Z","event_type":"add_to_cart","customer_id":"C010","session_id":"S010","product_id":"P010","campaign_id":"CMP005","channel":"email","device_type":"mobile","order_id":null,"quantity":1,"event_value":74.50}
]
